{
  "inputIndex": 0,
  "documentId": "xrechnung-valid",
  "fileName": "valid-xrechnung.xml",
  "processingStatus": "SUCCEEDED",
  "conformanceStatus": "ACCEPTED",
  "sourceFormat": "XML",
  "validationFamily": "XRECHNUNG",
  "syntax": "UBL_INVOICE",
  "profile": "XRECHNUNG_CIUS",
  "scenario": "EN16931 XRechnung (UBL Invoice)",
  "versions": {
    "validator": "1.6.0",
    "configurationRelease": "2026-01-31",
    "xrechnung": "3.0.2",
    "cenSchematron": "1.3.15",
    "mustang": "2.24.0",
    "veraPdf": "1.30.2",
    "zugferdRules": "2.5",
    "facturXRules": "1.09"
  },
  "counts": {
    "fatal": 0,
    "error": 0,
    "warning": 0,
    "information": 1
  },
  "findings": [
    {
      "severity": "INFORMATION",
      "ruleId": "BR-DE-TMP-32",
      "message": "[BR-DE-TMP-32] Eine Rechnung sollte zur Angabe des Liefer-/Leistungsdatums entweder BT-72 \"Actual delivery date\", BG-14 \"Invoicing period\" oder in jeder Rechnungsposition BG-26 \"Invoice line period\" enthalten.",
      "location": "/Q{urn:oasis:names:specification:ubl:schema:xsd:Invoice-2}Invoice[1]"
    }
  ],
  "findingsTruncated": false,
  "sha256": "3558d8eee6499350f69c150b54b4019556458667cfc972beaa9bb7bf1e11303f",
  "embeddedXmlSha256": null,
  "container": null,
  "checkedAt": "2026-07-29T05:53:18.155637Z",
  "reports": {
    "validationXmlKey": "VALIDATION-REPORT-0001-xrechnung-valid.xml",
    "htmlKey": "VALIDATION-REPORT-0001-xrechnung-valid.html"
  },
  "error": null
}
